{
  "schema_version": "m4.2-successor-preparation-v1",
  "milestone": "M4",
  "revision": "M4.2",
  "status": "PREPARATION_ONLY",
  "predecessor": {
    "terminal_closure_head": "e6ae2be7695ce1d2613dcd39e379ff458c1b60fe",
    "terminal_closure_ci_run_id": 31301984766,
    "terminal_closure_ci_conclusion": "success",
    "terminal_evidence_head": "80b54697c3e27a5dad0a24d5318ce26c8fe46141",
    "launch_claim": {
      "path": "evals/m4/execution/m4.1/launch-claim.json",
      "byte_length": 24078,
      "sha256": "c16a2e53aa2e9215e2325464d547356afdb73897bfc7d29605e0105b9987b3c6",
      "git_blob_oid": "794058739b96598955216b3960b95b0feea1208f"
    },
    "execution_terminal": {
      "path": "evals/m4/execution/m4.1/execution-terminal.json",
      "byte_length": 3707,
      "sha256": "7305d71ba94cd209f5bb0cb2c977db3bb157d95b907f8f59df9133c192f4d66e",
      "git_blob_oid": "76c7dc1ef88d587741d364536c86e389c296ad5c"
    },
    "failure_evidence": {
      "raw_evidence_sha256": "61a18842ac13637f9ba71a5dac6547d1fcbd4355127f97ea213e0ea44941f9c5",
      "observed_protocol_error": "authorization_already_claimed"
    },
    "authorization_token_status": "CONSUMED",
    "claim_count": 1,
    "terminal_state": "STOPPED_PROTOCOL_OR_INFRASTRUCTURE_FAILURE",
    "failed_stage": "post_claim_dual_confirmation",
    "successor_revision_required": true,
    "counts": {
      "aggregation_calls": 0,
      "attempts": 0,
      "finalizations": 0,
      "followups": 0,
      "judge_calls": 0,
      "repairs": 0,
      "results": 0,
      "retries": 0,
      "side_effects": 0,
      "tasks": 0,
      "threads": 0
    },
    "later_gates": {
      "judge": "NOT_RUN",
      "m4_closure": "NOT_RUN",
      "m5": "NOT_STARTED",
      "threshold_decision": "NOT_RUN",
      "unblinding_and_aggregation": "NOT_RUN"
    }
  },
  "source_preparation": {
    "path": "evals/m4/revisions/m4.1/preparation-manifest.json",
    "head": "fedc5cdeebd7a2943afeb6767d39841305c55444",
    "ci_run_id": 31248424046,
    "ci_conclusion": "success",
    "byte_length": 85962,
    "raw_sha256": "d66ad9d513d8e64307f9a1553242d9b7d840ea5432d084b06d86707c1b4c2b61",
    "git_blob_oid": "42a10d36e4d64ab98aa724114b904001107f557d",
    "task_count": 60,
    "source_order_sha256": "93155cdbd695851a82f96a4e93f76d3e106df490b291aa50b63a2e4e174ab0cd"
  },
  "authority": {
    "fresh_execution_authorized": false,
    "fresh_tasks_authorized": false,
    "result_writes_authorized": false,
    "retry_authorized": false,
    "repair_authorized": false,
    "authorization_artifact": null,
    "model_binding_status": "UNBOUND_UNTIL_SEPARATE_AUTHORIZATION"
  },
  "lifecycle_requirements": {
    "claim_aware_post_claim_confirmation_required": true,
    "post_claim_claim_absence_checks_authorized": false,
    "canonical_claim_path_integration_test_required": true,
    "same_revision_continuation_authorized": false
  },
  "matrix": {
    "case_count": 12,
    "arm_count": 5,
    "planned_task_count": 60,
    "batch_count": 6,
    "batches": [
      {
        "batch_id": "M4.2-BATCH-NUC",
        "source_batch_id": "M4.1-BATCH-NUC",
        "root_batch_id": "M4-BATCH-NUC",
        "domain": "nuclear_engineering",
        "task_ids": [
          "M4.2-NUC-A-F",
          "M4.2-NUC-B-A1",
          "M4.2-NUC-A-A1",
          "M4.2-NUC-B-A3",
          "M4.2-NUC-A-A2",
          "M4.2-NUC-B-F",
          "M4.2-NUC-A-N",
          "M4.2-NUC-B-A2",
          "M4.2-NUC-A-A3",
          "M4.2-NUC-B-N"
        ],
        "source_task_ids": [
          "M4.1-NUC-A-F",
          "M4.1-NUC-B-A1",
          "M4.1-NUC-A-A1",
          "M4.1-NUC-B-A3",
          "M4.1-NUC-A-A2",
          "M4.1-NUC-B-F",
          "M4.1-NUC-A-N",
          "M4.1-NUC-B-A2",
          "M4.1-NUC-A-A3",
          "M4.1-NUC-B-N"
        ],
        "root_task_ids": [
          "M4-NUC-A-F",
          "M4-NUC-B-A1",
          "M4-NUC-A-A1",
          "M4-NUC-B-A3",
          "M4-NUC-A-A2",
          "M4-NUC-B-F",
          "M4-NUC-A-N",
          "M4-NUC-B-A2",
          "M4-NUC-A-A3",
          "M4-NUC-B-N"
        ],
        "planned_task_count": 10,
        "stop_on_infrastructure_or_protocol_failure": true,
        "later_batches_mutable_after_observation": false
      },
      {
        "batch_id": "M4.2-BATCH-MEC",
        "source_batch_id": "M4.1-BATCH-MEC",
        "root_batch_id": "M4-BATCH-MEC",
        "domain": "mechanical_engineering",
        "task_ids": [
          "M4.2-MEC-A-N",
          "M4.2-MEC-A-A1",
          "M4.2-MEC-B-F",
          "M4.2-MEC-A-A3",
          "M4.2-MEC-B-A3",
          "M4.2-MEC-B-A1",
          "M4.2-MEC-B-A2",
          "M4.2-MEC-A-A2",
          "M4.2-MEC-A-F",
          "M4.2-MEC-B-N"
        ],
        "source_task_ids": [
          "M4.1-MEC-A-N",
          "M4.1-MEC-A-A1",
          "M4.1-MEC-B-F",
          "M4.1-MEC-A-A3",
          "M4.1-MEC-B-A3",
          "M4.1-MEC-B-A1",
          "M4.1-MEC-B-A2",
          "M4.1-MEC-A-A2",
          "M4.1-MEC-A-F",
          "M4.1-MEC-B-N"
        ],
        "root_task_ids": [
          "M4-MEC-A-N",
          "M4-MEC-A-A1",
          "M4-MEC-B-F",
          "M4-MEC-A-A3",
          "M4-MEC-B-A3",
          "M4-MEC-B-A1",
          "M4-MEC-B-A2",
          "M4-MEC-A-A2",
          "M4-MEC-A-F",
          "M4-MEC-B-N"
        ],
        "planned_task_count": 10,
        "stop_on_infrastructure_or_protocol_failure": true,
        "later_batches_mutable_after_observation": false
      },
      {
        "batch_id": "M4.2-BATCH-ELE",
        "source_batch_id": "M4.1-BATCH-ELE",
        "root_batch_id": "M4-BATCH-ELE",
        "domain": "electrical_engineering",
        "task_ids": [
          "M4.2-ELE-B-A2",
          "M4.2-ELE-B-A1",
          "M4.2-ELE-A-A1",
          "M4.2-ELE-A-N",
          "M4.2-ELE-A-F",
          "M4.2-ELE-B-A3",
          "M4.2-ELE-B-N",
          "M4.2-ELE-B-F",
          "M4.2-ELE-A-A3",
          "M4.2-ELE-A-A2"
        ],
        "source_task_ids": [
          "M4.1-ELE-B-A2",
          "M4.1-ELE-B-A1",
          "M4.1-ELE-A-A1",
          "M4.1-ELE-A-N",
          "M4.1-ELE-A-F",
          "M4.1-ELE-B-A3",
          "M4.1-ELE-B-N",
          "M4.1-ELE-B-F",
          "M4.1-ELE-A-A3",
          "M4.1-ELE-A-A2"
        ],
        "root_task_ids": [
          "M4-ELE-B-A2",
          "M4-ELE-B-A1",
          "M4-ELE-A-A1",
          "M4-ELE-A-N",
          "M4-ELE-A-F",
          "M4-ELE-B-A3",
          "M4-ELE-B-N",
          "M4-ELE-B-F",
          "M4-ELE-A-A3",
          "M4-ELE-A-A2"
        ],
        "planned_task_count": 10,
        "stop_on_infrastructure_or_protocol_failure": true,
        "later_batches_mutable_after_observation": false
      },
      {
        "batch_id": "M4.2-BATCH-AUT",
        "source_batch_id": "M4.1-BATCH-AUT",
        "root_batch_id": "M4-BATCH-AUT",
        "domain": "automation_control",
        "task_ids": [
          "M4.2-AUT-B-A2",
          "M4.2-AUT-B-A3",
          "M4.2-AUT-A-A3",
          "M4.2-AUT-B-A1",
          "M4.2-AUT-A-A1",
          "M4.2-AUT-B-N",
          "M4.2-AUT-A-A2",
          "M4.2-AUT-B-F",
          "M4.2-AUT-A-N",
          "M4.2-AUT-A-F"
        ],
        "source_task_ids": [
          "M4.1-AUT-B-A2",
          "M4.1-AUT-B-A3",
          "M4.1-AUT-A-A3",
          "M4.1-AUT-B-A1",
          "M4.1-AUT-A-A1",
          "M4.1-AUT-B-N",
          "M4.1-AUT-A-A2",
          "M4.1-AUT-B-F",
          "M4.1-AUT-A-N",
          "M4.1-AUT-A-F"
        ],
        "root_task_ids": [
          "M4-AUT-B-A2",
          "M4-AUT-B-A3",
          "M4-AUT-A-A3",
          "M4-AUT-B-A1",
          "M4-AUT-A-A1",
          "M4-AUT-B-N",
          "M4-AUT-A-A2",
          "M4-AUT-B-F",
          "M4-AUT-A-N",
          "M4-AUT-A-F"
        ],
        "planned_task_count": 10,
        "stop_on_infrastructure_or_protocol_failure": true,
        "later_batches_mutable_after_observation": false
      },
      {
        "batch_id": "M4.2-BATCH-COM",
        "source_batch_id": "M4.1-BATCH-COM",
        "root_batch_id": "M4-BATCH-COM",
        "domain": "computer_data",
        "task_ids": [
          "M4.2-COM-B-F",
          "M4.2-COM-B-A1",
          "M4.2-COM-B-A2",
          "M4.2-COM-A-N",
          "M4.2-COM-B-N",
          "M4.2-COM-A-A3",
          "M4.2-COM-B-A3",
          "M4.2-COM-A-A2",
          "M4.2-COM-A-F",
          "M4.2-COM-A-A1"
        ],
        "source_task_ids": [
          "M4.1-COM-B-F",
          "M4.1-COM-B-A1",
          "M4.1-COM-B-A2",
          "M4.1-COM-A-N",
          "M4.1-COM-B-N",
          "M4.1-COM-A-A3",
          "M4.1-COM-B-A3",
          "M4.1-COM-A-A2",
          "M4.1-COM-A-F",
          "M4.1-COM-A-A1"
        ],
        "root_task_ids": [
          "M4-COM-B-F",
          "M4-COM-B-A1",
          "M4-COM-B-A2",
          "M4-COM-A-N",
          "M4-COM-B-N",
          "M4-COM-A-A3",
          "M4-COM-B-A3",
          "M4-COM-A-A2",
          "M4-COM-A-F",
          "M4-COM-A-A1"
        ],
        "planned_task_count": 10,
        "stop_on_infrastructure_or_protocol_failure": true,
        "later_batches_mutable_after_observation": false
      },
      {
        "batch_id": "M4.2-BATCH-MPH",
        "source_batch_id": "M4.1-BATCH-MPH",
        "root_batch_id": "M4-BATCH-MPH",
        "domain": "multiphysics",
        "task_ids": [
          "M4.2-MPH-B-F",
          "M4.2-MPH-A-N",
          "M4.2-MPH-A-A2",
          "M4.2-MPH-A-A1",
          "M4.2-MPH-A-A3",
          "M4.2-MPH-B-A2",
          "M4.2-MPH-A-F",
          "M4.2-MPH-B-N",
          "M4.2-MPH-B-A1",
          "M4.2-MPH-B-A3"
        ],
        "source_task_ids": [
          "M4.1-MPH-B-F",
          "M4.1-MPH-A-N",
          "M4.1-MPH-A-A2",
          "M4.1-MPH-A-A1",
          "M4.1-MPH-A-A3",
          "M4.1-MPH-B-A2",
          "M4.1-MPH-A-F",
          "M4.1-MPH-B-N",
          "M4.1-MPH-B-A1",
          "M4.1-MPH-B-A3"
        ],
        "root_task_ids": [
          "M4-MPH-B-F",
          "M4-MPH-A-N",
          "M4-MPH-A-A2",